<?xml version="1.0" encoding="ISO-8859-1"?>
<!DOCTYPE bml SYSTEM "bml.dtd" []>

<bml>

<!-- expression 1 -->

<face id='ex1f1' start='1.11864' end='4.05085'>
	  <description level="1" type="gretabml">
		<reference>affect=tensed1</reference>
		<SPC.value>0</SPC.value>
		<TMP.value>0</TMP.value>
		<FLD.value>0</FLD.value>
		<PWR.value>0</PWR.value>
	  </description>
	</face>

<!-- expression 2 -->

<face id='ex2f2' start='7.67796' end='3.9661'>
	  <description level="1" type="gretabml">
		<reference>affect=tensed2</reference>
		<SPC.value>0</SPC.value>
		<TMP.value>0</TMP.value>
		<FLD.value>0</FLD.value>
		<PWR.value>0</PWR.value>
	  </description>
	</face>

<!-- expression 3 -->

<face id='ex3f3' start='14.4238' end='4.20339'>
	  <description level="1" type="gretabml">
		<reference>affect=tensed3</reference>
		<SPC.value>0</SPC.value>
		<TMP.value>0</TMP.value>
		<FLD.value>0</FLD.value>
		<PWR.value>0</PWR.value>
	  </description>
	</face>

	<gaze id='ex3o2' start='15.0847' stroke='15.3339' end='1.0339'>
	  <description level="1" type="gretabml">
		<reference>gaze=look_right</reference>
		<SPC.value>1</SPC.value>
		<TMP.value>0.9</TMP.value>
		<FLD.value>-1.0</FLD.value>
		<PWR.value>1</PWR.value>
	  </description>
	</gaze>


	<gaze id='ex3o1' stroke='16.3339' start='16.1864' end='1.01'>
	  <description level="1" type="gretabml">
		<reference>gaze=look_left</reference>
		<SPC.value>1</SPC.value>
		<TMP.value>0.9</TMP.value>
		<FLD.value>-1.0</FLD.value>
		<PWR.value>1</PWR.value>
	  </description>
	</gaze>


<!-- expression 4 -->

<face id='ex4f4' start='21.2712' end='5.08473'>
	  <description level="1" type="gretabml">
		<reference>affect=tensed4</reference>
		<SPC.value>0</SPC.value>
		<TMP.value>0</TMP.value>
		<FLD.value>0</FLD.value>
		<PWR.value>0</PWR.value>
	  </description>
	</face>

	<gaze id='ex4o3' stroke='22.3339' start='21.8644' end='1.61018'>
	  <description level="1" type="gretabml">
		<reference>gaze=look_right</reference>
		<SPC.value>1</SPC.value>
		<TMP.value>0.9</TMP.value>
		<FLD.value>-1.0</FLD.value>
		<PWR.value>1</PWR.value>
	  </description>
	</gaze>


	<gaze id='ex4o4' stroke='34.0339' start='23.4746' end='1.61015'>
	  <description level="1" type="gretabml">
		<reference>gaze=look_down</reference>
		<SPC.value>1</SPC.value>
		<TMP.value>0.9</TMP.value>
		<FLD.value>-1.0</FLD.value>
		<PWR.value>1</PWR.value>
	  </description>
	</gaze>

	<head id='ex4h1' start='21.9492' end='1.35593'>
	  <description level="1" type="gretabml">
		<reference>head=head_right</reference>
		<SPC.value>1</SPC.value>
		<TMP.value>-0.97</TMP.value>
		<FLD.value>-1.0</FLD.value>
		<PWR.value>1</PWR.value>
	  </description>
	</head>

	<head id='ex4h2' start='23.3898' end='1.52546'>
	  <description level="1" type="gretabml">
		<reference>head=head_left</reference>
		<SPC.value>1</SPC.value>
		<TMP.value>1</TMP.value>
		<FLD.value>-1.0</FLD.value>
		<PWR.value>1</PWR.value>
	  </description>
	</head>

<!-- expression 5 -->

	<face id='ex8f8' type='MOUTH' shape='SMILE' start='30.5017' end='6.04407'>
	  <description level="1" type="gretabml">
		<reference>affect=tensed3</reference>
		<SPC.value>0</SPC.value>
		<TMP.value>0</TMP.value>
		<FLD.value>0</FLD.value>
		<PWR.value>0</PWR.value>
	  </description>
	</face>


<torso id='exp5t2' posture='extend'  start='31.9017' stroke='4.2' end='6.04407'>
	  <description level="1" type="gretabml">
		<reference>tensed</reference>
		<SPC.value>-0.5</SPC.value>
		<TMP.value>-1</TMP.value>
		<FLD.value> -1</FLD.value>
		<PWR.value>-1</PWR.value>
	  </description>
	</torso>

<!-- expression 6 -->

	<face id='ex7f7' type='MOUTH' shape='SMILE' start='43.9322' end='65.44407'>
	  <description level="1" type="gretabml">
		<reference>affect=tensed3</reference>
		<SPC.value>0</SPC.value>
		<TMP.value>0</TMP.value>
		<FLD.value>0</FLD.value>
		<PWR.value>0</PWR.value>
	  </description>
	</face>

	<face id='ex8f9' type='MOUTH' shape='SMILE' start='46.77' end='3'>
	  <description level="1" type="gretabml">
		<reference>certainty=eyes_closed</reference>
		<SPC.value>1</SPC.value>
		<TMP.value>0.9</TMP.value>
		<FLD.value>-1.0</FLD.value>
		<PWR.value>1</PWR.value>
	  </description>
	</face>

	<gesture id='ex7gesture3' type='BEAT' stroke='0.4' start='46.9017' end='2.84407'>
	  <description level="1" type="gretabml">
		<reference>EMOTION=tension21</reference>
		<SPC.value>0.1</SPC.value>
		<TMP.value>1</TMP.value>
		<FLD.value>-1</FLD.value>
		<PWR.value>1</PWR.value>
	  </description>
	</gesture>

<!-- expression 8 -->


</bml>
