<?xml version="1.0" encoding="ISO-8859-1"?>
<!DOCTYPE bml SYSTEM "bml.dtd" []>

<bml>

<!-- expression 1 -->

<face id='ex1' start='0.881352' end='3.62712'>
  <description level="1" type="gretabml">
		<reference>affect=fear1</reference>
		<SPC.value>0</SPC.value>
		<TMP.value>0</TMP.value>
		<FLD.value>0</FLD.value>
		<PWR.value>0</PWR.value>
	  </description>
	</face>

<!-- expression 2 -->

<face id='ex2' start='6.52542' end='4.32204'>
  <description level="1" type="gretabml">
		<reference>affect=fear2</reference>
		<SPC.value>0</SPC.value>
		<TMP.value>0</TMP.value>
		<FLD.value>0</FLD.value>
		<PWR.value>0</PWR.value>
	  </description>
	</face>


<!-- expression 3 -->

<face id='ex3' start='12.6949' end='5.0678'>
  <description level="1" type="gretabml">
		<reference>affect=fear3</reference>
		<SPC.value>0</SPC.value>
		<TMP.value>0</TMP.value>
		<FLD.value>0</FLD.value>
		<PWR.value>0</PWR.value>
	  </description>
	</face>

<!-- expression 4 -->

<face id='ex4' start='19.7289' end='4.69572'>
  <description level="1" type="gretabml">
		<reference>affect=fear4</reference>
		<SPC.value>0</SPC.value>
		<TMP.value>0</TMP.value>
		<FLD.value>0</FLD.value>
		<PWR.value>0</PWR.value>
	  </description>
	</face>

<!-- expression 5 -->

	<face id='exp7f3' start='20.8439' end='3.15254'>
	  <description level="1" type="gretabml">
		<reference>affect=fear3</reference>
		<SPC.value>0</SPC.value>
		<TMP.value>0</TMP.value>
		<FLD.value>0</FLD.value>
		<PWR.value>0</PWR.value>
	  </description>
	</face>

	<gesture id='exp7handon' start='21.3478' stroke='0.9' end='3.85053'>
	  <description level="1" type="gretabml">
		<reference>EMOTION=FEAR22</reference>
		<SPC.value>0</SPC.value>
		<TMP.value>1</TMP.value>
		<FLD.value>-1</FLD.value>
		<PWR.value>1</PWR.value>
	  </description>
	</gesture>

<!-- expression 6 -->

	<face id='exp8f5' start='28.0894' end='3.15254'>
	  <description level="1" type="gretabml">
		<reference>affect=fear3</reference>
		<SPC.value>0</SPC.value>
		<TMP.value>0</TMP.value>
		<FLD.value>0</FLD.value>
		<PWR.value>0</PWR.value>
	  </description>
	</face>

	<gesture id='exp8handface' start='28.7382' stroke='0.3' end='3.58983'>
	  <description level="1" type="gretabml">
		<reference>EMOTION=FEAR11</reference>
		<SPC.value>-0.41</SPC.value>
		<TMP.value>1</TMP.value>
		<FLD.value>-1</FLD.value>
		<PWR.value>0.99</PWR.value>
	  </description>
	</gesture>

</bml>
