<?xml version="1.0" encoding="ISO-8859-1"?>
<!DOCTYPE bml SYSTEM "bml.dtd" []>

<bml>

<!-- expression 1 -->

<face id='exp1f1' start='1.0' end='4'>
	  <description level="1" type="gretabml">
		<reference>affect=relief1</reference>
		<SPC.value>0</SPC.value>
		<TMP.value>0</TMP.value>
		<FLD.value>0</FLD.value>
		<PWR.value>0</PWR.value>
	  </description>
	</face>

<!-- expression 2 -->

<face id='exp2f2' type='MOUTH' shape='SMILE' start='5' end='4'>
	  <description level="1" type="gretabml">
		<reference>affect=relief2</reference>
		<SPC.value>0</SPC.value>
		<TMP.value>0</TMP.value>
		<FLD.value>0</FLD.value>
		<PWR.value>0</PWR.value>
	  </description>
	</face>

<!-- expression 3 -->

<face id='exp3f3' start='10' end='4'>
	  <description level="1" type="gretabml">
		<reference>affect=relief3</reference>
		<SPC.value>0</SPC.value>
		<TMP.value>0</TMP.value>
		<FLD.value>0</FLD.value>
		<PWR.value>0</PWR.value>
	  </description>
	</face>


<!-- expression 4 -->

<face id='exp4f4' start='16.010165' end='7.07797'>
	  <description level="1" type="gretabml">
		<reference>affect=relief2</reference>
		<SPC.value>0</SPC.value>
		<TMP.value>0</TMP.value>
		<FLD.value>0</FLD.value>
		<PWR.value>0</PWR.value>
	  </description>
	</face>


<torso id='exp4t1' posture='extend' start='16.610165' stroke='4.2' end='8.67797'>
	  <description level="1" type="gretabml">
		<reference>relief4</reference>
		<SPC.value>-0.5</SPC.value>
		<TMP.value>1</TMP.value>
		<FLD.value>1.0</FLD.value>
		<PWR.value>-0.5</PWR.value>
	  </description>
	</torso>


<!-- expression 5 -->

<face id='exp5f5' start='28.610165' end='5.67797'>
	  <description level="1" type="gretabml">
		<reference>affect=relief3</reference>
		<SPC.value>0</SPC.value>
		<TMP.value>0</TMP.value>
		<FLD.value>0</FLD.value>
		<PWR.value>0</PWR.value>
	  </description>
	</face>

<torso id='exp5t2' posture='extend' start='27.610165' end='5.67797' stroke='2.2'>
	  <description level="1" type="gretabml">
		<reference>relief5</reference>
		<SPC.value>-0.5</SPC.value>
		<TMP.value>1</TMP.value>
		<FLD.value>1.0</FLD.value>
		<PWR.value>-0.1</PWR.value>
	  </description>
	</torso>

</bml>
